{
  "schemaVersion": 1,
  "id": "event-0273",
  "id_num": 273,
  "slug": "common-practice-period-music",
  "status": "review",
  "name": "Common practice period (music)",
  "short_desc": "In Western classical music, the common practice period was the period of about 250 years during which the tonal system was regarded as the only basis for composition.",
  "long_desc": "Common practice period (music)",
  "start": 1580,
  "end": 1910,
  "location": null,
  "type": "Period",
  "field": "History",
  "relevance": 1,
  "source": "https://en.wikipedia.org/wiki/Common_practice_period",
  "image": null,
  "casualties_low": null,
  "casualties_high": null,
  "dubious": null,
  "date_kind": "span",
  "date_note": "",
  "places": [],
  "notes": "",
  "legacy": {
    "id": "common-practice-period-music",
    "Unnamed: 30": null,
    "Unnamed: 31": null,
    "anthropologic": "Early modern period",
    "archeological": "",
    "bailey_link": null,
    "city": null,
    "climatic": "",
    "country": null,
    "country_map": null,
    "curr_year": 2023,
    "duration": 330,
    "generation_diff": 17,
    "generations_end": 5,
    "generations_start": 22,
    "geologic_eon": "Phanerozoic",
    "geologic_epoch": "Holocene",
    "geologic_era": "Cenozoic",
    "geologic_period": "Quarternary",
    "id_num": 273,
    "img_md": "",
    "img_sm": "",
    "range_type": null,
    "time_bp_end": 113,
    "time_bp_start": 443,
    "time_end": "1910 ",
    "time_start": "1580 ",
    "location_info": {
      "display_name": "Nanno, Ville d'Anaunia, Comunità della Val di Non, Provincia di Trento, Trentino-Alto Adige/Südtirol, 38093, Italia",
      "boundingbox": [
        "46.2944754",
        "46.3344754",
        "11.0280288",
        "11.0680288"
      ],
      "osm_id": 64776641,
      "osm_type": "node",
      "coordinates": [
        46.3144754,
        11.0480288
      ]
    }
  }
}
