{
  "schemaVersion": 1,
  "id": "event-0092",
  "id_num": 92,
  "slug": "tournettes",
  "status": "review",
  "name": "Tournettes",
  "short_desc": "Tournettes (proto-wheels)",
  "long_desc": "Tournettes",
  "start": -5200,
  "end": -4700,
  "location": "Iran",
  "type": "Event",
  "field": null,
  "relevance": 1,
  "source": null,
  "image": null,
  "casualties_low": null,
  "casualties_high": null,
  "dubious": null,
  "date_kind": "uncertain",
  "date_note": "Legacy range_type=1. Review whether these are uncertain bounds rather than a duration.",
  "places": [
    "place-18d4e170765c"
  ],
  "notes": "",
  "legacy": {
    "id": "tournettes",
    "Unnamed: 30": null,
    "Unnamed: 31": null,
    "anthropologic": "Prehistory",
    "archeological": "Western European Neolithic",
    "bailey_link": null,
    "city": null,
    "climatic": "",
    "country": null,
    "country_map": null,
    "curr_year": 2023,
    "duration": null,
    "generation_diff": 28,
    "generations_end": 373,
    "generations_start": 401,
    "geologic_eon": "Phanerozoic",
    "geologic_epoch": "Holocene",
    "geologic_era": "Cenozoic",
    "geologic_period": "Quarternary",
    "id_num": 92,
    "img_md": "",
    "img_sm": "",
    "range_type": 1,
    "time_bp_end": 6700,
    "time_bp_start": 7200,
    "time_end": "4700 BCE",
    "time_start": "5200 BCE",
    "location_info": {
      "display_name": "ایران",
      "boundingbox": [
        "24.8353084",
        "39.7824624",
        "44.0318908",
        "63.3332704"
      ],
      "osm_id": 304938,
      "osm_type": "relation",
      "coordinates": [
        32.6475314,
        54.5643516
      ]
    }
  }
}
