{
  "schemaVersion": 1,
  "id": "event-0607",
  "id_num": 607,
  "slug": null,
  "status": "review",
  "name": "Henry Kissinger",
  "short_desc": "An American diplomat who helped shape US relations with China, the Soviet Union and other Cold War powers.",
  "long_desc": null,
  "start": 1923,
  "end": 2023,
  "location": null,
  "type": "Person",
  "field": "History",
  "relevance": 1,
  "source": "https://en.wikipedia.org/wiki/Henry_Kissinger",
  "image": null,
  "casualties_low": null,
  "casualties_high": null,
  "dubious": null,
  "date_kind": "span",
  "date_note": "",
  "places": [],
  "notes": "New source-linked entry. The Wikipedia introduction, date evidence and article identity received an initial editorial check; independent claim-specific source review remains open.",
  "legacy": {},
  "date_label": "Lifespan",
  "periods": [],
  "timeline_period": null
}
