{
  "schemaVersion": 1,
  "id": "event-0668",
  "id_num": 668,
  "slug": null,
  "status": "review",
  "name": "Shang dynasty",
  "short_desc": "A Bronze Age dynasty in the Yellow River valley known for royal tombs, bronze casting and oracle-bone writing.",
  "long_desc": null,
  "start": -1600,
  "end": -1046,
  "location": "China",
  "type": "Polity",
  "field": "History",
  "relevance": 1,
  "source": "https://en.wikipedia.org/wiki/Shang_dynasty",
  "image": null,
  "casualties_low": null,
  "casualties_high": null,
  "dubious": null,
  "date_kind": "span",
  "date_note": "Approximate conventional bounds.",
  "places": [
    "place-10436829032f"
  ],
  "notes": "Initial article identity, date meaning and source review completed. Summary authored for this catalog; independent claim-specific citations remain open.",
  "legacy": {},
  "date_label": "Political existence",
  "periods": [],
  "timeline_period": null,
  "priority": 2
}
