{
  "schemaVersion": 1,
  "id": "event-0594",
  "id_num": 594,
  "slug": null,
  "status": "review",
  "name": "Donatello",
  "short_desc": "A Florentine sculptor whose work helped establish the naturalism of the early Renaissance.",
  "long_desc": null,
  "start": 1386,
  "end": 1466,
  "location": null,
  "type": "Person",
  "field": "History",
  "relevance": 1,
  "source": "https://en.wikipedia.org/wiki/Donatello",
  "image": null,
  "casualties_low": null,
  "casualties_high": null,
  "dubious": null,
  "date_kind": "span",
  "date_note": "Born about 1386; died in 1466.",
  "places": [],
  "notes": "New source-linked entry. The Wikipedia introduction, date evidence and article identity received an initial editorial check; independent claim-specific source review remains open.",
  "legacy": {},
  "date_label": "Lifespan",
  "periods": [],
  "timeline_period": null
}
