{
  "schemaVersion": 1,
  "id": "event-0344",
  "id_num": 344,
  "slug": "meiji-restoration",
  "status": "review",
  "name": "Meiji restoration",
  "short_desc": "A political revolution restores formal imperial rule in Japan.",
  "long_desc": null,
  "start": 1868,
  "end": null,
  "location": "Japan",
  "type": "Event",
  "field": "History",
  "relevance": 1,
  "source": "https://en.wikipedia.org/wiki/Meiji_Restoration",
  "image": "https://upload.wikimedia.org/wikipedia/commons/thumb/6/65/Mutsuhito-Emperor-Meiji-1873.png/1920px-Mutsuhito-Emperor-Meiji-1873.png",
  "casualties_low": null,
  "casualties_high": null,
  "dubious": null,
  "date_kind": "point",
  "date_note": "",
  "places": [
    "place-647294383b2c"
  ],
  "notes": "",
  "legacy": {
    "id": "meiji-restoration",
    "Unnamed: 30": null,
    "Unnamed: 31": null,
    "anthropologic": "Late modern period",
    "archeological": "",
    "bailey_link": null,
    "city": null,
    "climatic": "",
    "country": null,
    "country_map": null,
    "curr_year": 2023,
    "duration": null,
    "generation_diff": null,
    "generations_end": null,
    "generations_start": 7,
    "geologic_eon": "Phanerozoic",
    "geologic_epoch": "Holocene",
    "geologic_era": "Cenozoic",
    "geologic_period": "Quarternary",
    "id_num": 344,
    "img_md": "https://upload.wikimedia.org/wikipedia/commons/thumb/6/65/Mutsuhito-Emperor-Meiji-1873.png/960px-Mutsuhito-Emperor-Meiji-1873.png",
    "img_sm": "https://upload.wikimedia.org/wikipedia/commons/thumb/6/65/Mutsuhito-Emperor-Meiji-1873.png/330px-Mutsuhito-Emperor-Meiji-1873.png",
    "range_type": null,
    "time_bp_end": null,
    "time_bp_start": 155,
    "time_end": null,
    "time_start": "1868 ",
    "location_info": {
      "display_name": "日本",
      "boundingbox": [
        "20.2145811",
        "45.7112046",
        "122.7141754",
        "154.205541"
      ],
      "osm_id": 382313,
      "osm_type": "relation",
      "coordinates": [
        36.5748441,
        139.2394179
      ]
    }
  }
}
