{
  "schemaVersion": 1,
  "id": "event-0765",
  "id_num": 765,
  "slug": null,
  "status": "review",
  "name": "Red Turban Rebellions",
  "short_desc": "Rebellions against Yuan rule help bring about the rise of the Ming dynasty.",
  "long_desc": null,
  "start": 1351,
  "end": 1368,
  "location": null,
  "type": "Rebellion",
  "field": "History",
  "relevance": 1,
  "source": "https://en.wikipedia.org/wiki/Red_Turban_Rebellions",
  "image": null,
  "casualties_low": null,
  "casualties_high": null,
  "dubious": null,
  "date_kind": "span",
  "date_note": "",
  "places": [],
  "notes": "Initial article identity, date meaning and source review completed. Summary authored for this catalog; independent claim-specific citations remain open.",
  "legacy": {},
  "date_label": "Rebellion",
  "periods": [],
  "timeline_period": null
}
