{
  "schemaVersion": 1,
  "id": "event-0596",
  "id_num": 596,
  "slug": null,
  "status": "review",
  "name": "Edwin Hubble",
  "short_desc": "An astronomer who established that other galaxies lie beyond the Milky Way and studied their recession.",
  "long_desc": null,
  "start": 1889,
  "end": 1953,
  "location": "United States",
  "type": "Person",
  "field": "History",
  "relevance": 1,
  "source": "https://en.wikipedia.org/wiki/Edwin_Hubble",
  "image": null,
  "casualties_low": null,
  "casualties_high": null,
  "dubious": null,
  "date_kind": "span",
  "date_note": "",
  "places": [
    "place-49dca65f362f"
  ],
  "notes": "New source-linked entry. The Wikipedia introduction, date evidence and article identity received an initial editorial check; independent claim-specific source review remains open.",
  "legacy": {},
  "date_label": "Lifespan",
  "periods": [],
  "timeline_period": null,
  "priority": 2
}
