{
  "schemaVersion": 1,
  "id": "event-0116",
  "id_num": 116,
  "slug": "phoenician-civilization",
  "status": "review",
  "name": "Phoenician civilization",
  "short_desc": "Phoenician civilization (Lebanon, Levant)",
  "long_desc": "Phoenician civilization",
  "start": -2500,
  "end": -64,
  "location": null,
  "type": "Unit",
  "field": null,
  "relevance": 1,
  "source": "https://en.wikipedia.org/wiki/Phoenicia",
  "image": null,
  "casualties_low": null,
  "casualties_high": null,
  "dubious": null,
  "date_kind": "span",
  "date_note": "",
  "places": [],
  "notes": "\nBackground source added 24 October 2026. Existing date claims require specific source verification.",
  "legacy": {
    "id": "phoenician-civilization",
    "Unnamed: 30": null,
    "Unnamed: 31": null,
    "anthropologic": "",
    "archeological": "",
    "bailey_link": null,
    "city": null,
    "climatic": "",
    "country": null,
    "country_map": null,
    "curr_year": 2023,
    "duration": 2436,
    "generation_diff": 122,
    "generations_end": 104,
    "generations_start": 226,
    "geologic_eon": "Phanerozoic",
    "geologic_epoch": "Holocene",
    "geologic_era": "Cenozoic",
    "geologic_period": "Quarternary",
    "id_num": 116,
    "img_md": "",
    "img_sm": "",
    "range_type": null,
    "time_bp_end": 2000,
    "time_bp_start": 4500,
    "time_end": "64 BCE",
    "time_start": "2500 BCE",
    "location_info": {
      "display_name": "Nanno, Ville d'Anaunia, Comunità della Val di Non, Provincia di Trento, Trentino-Alto Adige/Südtirol, 38093, Italia",
      "boundingbox": [
        "46.2944754",
        "46.3344754",
        "11.0280288",
        "11.0680288"
      ],
      "osm_id": 64776641,
      "osm_type": "node",
      "coordinates": [
        46.3144754,
        11.0480288
      ]
    }
  }
}
