{
  "schemaVersion": 1,
  "id": "event-0272",
  "id_num": 272,
  "slug": "baroque-music",
  "status": "review",
  "name": "Baroque music",
  "short_desc": "Baroque music (UK:  or US: ) refers to the period or dominant style of Western classical music composed from about 1600 to 1750.",
  "long_desc": "Baroque music",
  "start": 1580,
  "end": 1750,
  "location": null,
  "type": "Period",
  "field": "History",
  "relevance": 1,
  "source": "https://en.wikipedia.org/wiki/Baroque_music",
  "image": "https://upload.wikimedia.org/wikipedia/commons/5/50/Baschenis_-_Musical_Instruments.jpg",
  "casualties_low": null,
  "casualties_high": null,
  "dubious": null,
  "date_kind": "span",
  "date_note": "",
  "places": [],
  "notes": "",
  "legacy": {
    "id": "baroque-music",
    "Unnamed: 30": null,
    "Unnamed: 31": null,
    "anthropologic": "Early modern period",
    "archeological": "",
    "bailey_link": null,
    "city": null,
    "climatic": "",
    "country": null,
    "country_map": null,
    "curr_year": 2023,
    "duration": 170,
    "generation_diff": 9,
    "generations_end": 13,
    "generations_start": 22,
    "geologic_eon": "Phanerozoic",
    "geologic_epoch": "Holocene",
    "geologic_era": "Cenozoic",
    "geologic_period": "Quarternary",
    "id_num": 272,
    "img_md": "https://upload.wikimedia.org/wikipedia/commons/thumb/5/50/Baschenis_-_Musical_Instruments.jpg/960px-Baschenis_-_Musical_Instruments.jpg",
    "img_sm": "https://upload.wikimedia.org/wikipedia/commons/thumb/5/50/Baschenis_-_Musical_Instruments.jpg/330px-Baschenis_-_Musical_Instruments.jpg",
    "range_type": null,
    "time_bp_end": 273,
    "time_bp_start": 443,
    "time_end": "1750 ",
    "time_start": "1580 ",
    "location_info": {
      "display_name": "Nanno, Ville d'Anaunia, Comunità della Val di Non, Provincia di Trento, Trentino-Alto Adige/Südtirol, 38093, Italia",
      "boundingbox": [
        "46.2944754",
        "46.3344754",
        "11.0280288",
        "11.0680288"
      ],
      "osm_id": 64776641,
      "osm_type": "node",
      "coordinates": [
        46.3144754,
        11.0480288
      ]
    }
  }
}
