{
  "schemaVersion": 1,
  "id": "event-0250",
  "id_num": 250,
  "slug": "sengoku-period",
  "status": "review",
  "name": "Sengoku period",
  "short_desc": "Rival warlords fight for control of Japan during a prolonged period of political fragmentation.",
  "long_desc": "Sengoku period",
  "start": 1467,
  "end": 1590,
  "location": "Japan",
  "type": "Event",
  "field": "History",
  "relevance": 1,
  "source": "https://en.wikipedia.org/wiki/Sengoku_period",
  "image": "https://upload.wikimedia.org/wikipedia/commons/a/a6/Sengoku_period_battle.jpg",
  "casualties_low": null,
  "casualties_high": null,
  "dubious": null,
  "date_kind": "span",
  "date_note": "",
  "places": [
    "place-647294383b2c"
  ],
  "notes": "",
  "legacy": {
    "id": "sengoku-period",
    "Unnamed: 30": null,
    "Unnamed: 31": null,
    "anthropologic": "Late Middle Ages",
    "archeological": "",
    "bailey_link": null,
    "city": null,
    "climatic": "",
    "country": null,
    "country_map": null,
    "curr_year": 2023,
    "duration": 123,
    "generation_diff": 6,
    "generations_end": 21,
    "generations_start": 27,
    "geologic_eon": "Phanerozoic",
    "geologic_epoch": "Holocene",
    "geologic_era": "Cenozoic",
    "geologic_period": "Quarternary",
    "id_num": 250,
    "img_md": "https://upload.wikimedia.org/wikipedia/commons/a/a6/Sengoku_period_battle.jpg",
    "img_sm": "https://upload.wikimedia.org/wikipedia/commons/thumb/a/a6/Sengoku_period_battle.jpg/330px-Sengoku_period_battle.jpg",
    "range_type": null,
    "time_bp_end": 433,
    "time_bp_start": 556,
    "time_end": "1590 ",
    "time_start": "1467 ",
    "location_info": {
      "display_name": "日本",
      "boundingbox": [
        "20.2145811",
        "45.7112046",
        "122.7141754",
        "154.205541"
      ],
      "osm_id": 382313,
      "osm_type": "relation",
      "coordinates": [
        36.5748441,
        139.2394179
      ]
    }
  }
}
