{
  "schemaVersion": 1,
  "id": "event-0707",
  "id_num": 707,
  "slug": null,
  "status": "review",
  "name": "Northern Yuan",
  "short_desc": "Mongol rulers continue the Yuan imperial tradition after retreating from China.",
  "long_desc": null,
  "start": 1368,
  "end": 1635,
  "location": "China",
  "type": "Polity",
  "field": "History",
  "relevance": 1,
  "source": "https://en.wikipedia.org/wiki/Northern_Yuan",
  "image": null,
  "casualties_low": null,
  "casualties_high": null,
  "dubious": null,
  "date_kind": "span",
  "date_note": "Dates describe a changing Mongolian successor state, not continued Yuan rule over China.",
  "places": [
    "place-10436829032f"
  ],
  "notes": "Initial article identity, date meaning and source review completed. Summary authored for this catalog; independent claim-specific citations remain open.",
  "legacy": {},
  "date_label": "Political existence",
  "periods": [],
  "timeline_period": null,
  "priority": 4
}
