{
  "schemaVersion": 1,
  "id": "event-0472",
  "id_num": 472,
  "slug": "compass",
  "status": "review",
  "name": "Early Chinese magnetic compass",
  "short_desc": "Early Chinese devices use magnetism to indicate direction.",
  "long_desc": null,
  "start": -200,
  "end": 200,
  "location": null,
  "type": "Invention",
  "field": "History",
  "relevance": 1,
  "source": "https://en.wikipedia.org/wiki/Compass",
  "image": null,
  "casualties_low": null,
  "casualties_high": null,
  "dubious": null,
  "date_kind": "uncertain",
  "date_note": "Early Chinese lodestone devices are assigned broadly to the Han period. These bounds do not date the later use of a needle at sea; see record 493.",
  "places": [],
  "notes": "",
  "legacy": {
    "id": "compass",
    "Unnamed: 30": null,
    "Unnamed: 31": null,
    "anthropologic": "",
    "archeological": "",
    "bailey_link": null,
    "city": null,
    "climatic": "",
    "country": null,
    "country_map": null,
    "curr_year": 2023,
    "duration": null,
    "generation_diff": null,
    "generations_end": null,
    "generations_start": null,
    "geologic_eon": "",
    "geologic_epoch": "",
    "geologic_era": "",
    "geologic_period": "",
    "id_num": 472,
    "img_md": "",
    "img_sm": "",
    "range_type": null,
    "time_bp_end": null,
    "time_bp_start": null,
    "time_end": null,
    "time_start": null,
    "location_info": {
      "display_name": "Nanno, Ville d'Anaunia, Comunità della Val di Non, Provincia di Trento, Trentino-Alto Adige/Südtirol, 38093, Italia",
      "boundingbox": [
        "46.2944754",
        "46.3344754",
        "11.0280288",
        "11.0680288"
      ],
      "osm_id": 64776641,
      "osm_type": "node",
      "coordinates": [
        46.3144754,
        11.0480288
      ]
    }
  }
}
