{
  "schemaVersion": 1,
  "id": "event-0358",
  "id_num": 358,
  "slug": "summer-olympic-games",
  "status": "review",
  "name": "Summer Olympic Games",
  "short_desc": "Modern international summer sports competitions revive the Olympic tradition.",
  "long_desc": null,
  "start": 1896,
  "end": null,
  "location": "World",
  "type": "Event",
  "field": "History",
  "relevance": 1,
  "source": "https://en.wikipedia.org/wiki/Summer_Olympic_Games",
  "image": "https://upload.wikimedia.org/wikipedia/commons/thumb/5/5c/Olympic_rings_without_rims.svg/1920px-Olympic_rings_without_rims.svg.png",
  "casualties_low": null,
  "casualties_high": null,
  "dubious": null,
  "date_kind": "point",
  "date_note": "",
  "places": [
    "place-78ae647dc554"
  ],
  "notes": "",
  "legacy": {
    "id": "summer-olympic-games",
    "Unnamed: 30": null,
    "Unnamed: 31": null,
    "anthropologic": "Late modern period",
    "archeological": "",
    "bailey_link": null,
    "city": null,
    "climatic": "",
    "country": null,
    "country_map": null,
    "curr_year": 2023,
    "duration": null,
    "generation_diff": null,
    "generations_end": null,
    "generations_start": 6,
    "geologic_eon": "Phanerozoic",
    "geologic_epoch": "Holocene",
    "geologic_era": "Cenozoic",
    "geologic_period": "Quarternary",
    "id_num": 358,
    "img_md": "https://upload.wikimedia.org/wikipedia/commons/thumb/5/5c/Olympic_rings_without_rims.svg/960px-Olympic_rings_without_rims.svg.png",
    "img_sm": "https://upload.wikimedia.org/wikipedia/commons/thumb/5/5c/Olympic_rings_without_rims.svg/330px-Olympic_rings_without_rims.svg.png",
    "range_type": null,
    "time_bp_end": null,
    "time_bp_start": 127,
    "time_end": null,
    "time_start": "1896 ",
    "location_info": {
      "display_name": "World, 179, Ponsonby Road, Three Lamps, Ponsonby, Auckland, Waitematā, Auckland, 1011, New Zealand/Aotearoa",
      "boundingbox": [
        "-36.8536212",
        "-36.8535212",
        "174.7456309",
        "174.7457309"
      ],
      "osm_id": 1036654017,
      "osm_type": "node",
      "coordinates": [
        -36.8535712,
        174.7456809
      ]
    }
  }
}
